{
 "schema_version": 1,
 "note": "Generated from arthur/index/quotes.json by scripts/ingest/build-quote-anchors.mjs. Every entry has been located in its source text; `spine` is where it sits in the reading text, when the portal publishes that work.",
 "built_at": "2026-08-14",
 "counts": {
  "total": 25,
  "placed": 9,
  "unplaceable": 0
 },
 "quotes": [
  {
   "id": "geoffrey-boar-of-cornwall",
   "voice": "Geoffrey of Monmouth",
   "source": "geoffrey",
   "work": "geoffrey",
   "work_title": "The History of the Kings of Britain",
   "branch": "chronicle",
   "citation": "The History of the Kings of Britain",
   "anchor_label": "Bk VII, ch. III",
   "text": "the Boar of Cornwall shall bring succour and shall trample their necks beneath his feet",
   "tags": [
    "foreknowledge-and-doom",
    "source-of-rule"
   ],
   "restricted": false,
   "validation": {
    "method": "fuzzy",
    "ratio": 0.9726,
    "threshold": 0.9,
    "checked_at": "2026-08-14"
   },
   "spine": null
  },
  {
   "id": "geoffrey-caliburn-avalon",
   "voice": "Geoffrey of Monmouth",
   "source": "geoffrey",
   "work": "geoffrey",
   "work_title": "The History of the Kings of Britain",
   "branch": "chronicle",
   "citation": "The History of the Kings of Britain",
   "anchor_label": "Bk IX, ch. I",
   "text": "best of swords, that was forged within the Isle of Avalon",
   "tags": [
    "source-of-rule",
    "sword-and-sovereignty"
   ],
   "restricted": false,
   "validation": {
    "method": "exact",
    "ratio": 1,
    "threshold": 0.9,
    "checked_at": "2026-08-14"
   },
   "spine": null
  },
  {
   "id": "geoffrey-arthur-to-avalon",
   "voice": "Geoffrey of Monmouth",
   "source": "geoffrey",
   "work": "geoffrey",
   "work_title": "The History of the Kings of Britain",
   "branch": "chronicle",
   "citation": "The History of the Kings of Britain",
   "anchor_label": "Bk XI, ch. II",
   "text": "the renowned King Arthur himself was wounded deadly, and was borne thence unto the island of Avalon for the healing of his wounds",
   "tags": [
    "once-and-future",
    "the-wound-and-wasteland"
   ],
   "restricted": false,
   "validation": {
    "method": "exact",
    "ratio": 1,
    "threshold": 0.9,
    "checked_at": "2026-08-14"
   },
   "spine": null
  },
  {
   "id": "chretien-love-over-shame",
   "voice": "Chrétien de Troyes",
   "source": "chretien",
   "work": "chretien",
   "work_title": "Four Arthurian Romances",
   "branch": "french",
   "citation": "Lancelot, or the Knight of the Cart (Comfort trans.)",
   "anchor_label": "Lancelot (the Cart)",
   "text": "Reason, which dares thus speak to him, reaches only his lips, but not his heart; but love is enclosed within his heart, bidding him and urging him to mount at once upon the cart",
   "tags": [
    "courtly-love",
    "the-cost"
   ],
   "restricted": false,
   "validation": {
    "method": "exact",
    "ratio": 1,
    "threshold": 0.9,
    "checked_at": "2026-08-14"
   },
   "spine": null
  },
  {
   "id": "wolfram-anfortas-wounded",
   "voice": "Wolfram von Eschenbach",
   "source": "wolfram2",
   "work": "parzival",
   "work_title": "Parzival",
   "branch": "german",
   "citation": "Parzival (Weston trans.)",
   "anchor_label": "Parzival (Anfortas)",
   "text": "Anfortas, the gentle monarch, who was courteous as he was bold",
   "tags": [
    "the-wound-and-wasteland",
    "the-grail"
   ],
   "restricted": false,
   "validation": {
    "method": "exact",
    "ratio": 1,
    "threshold": 0.9,
    "checked_at": "2026-08-14"
   },
   "spine": null
  },
  {
   "id": "vulgate-lancelot-loves-queen",
   "voice": "The Vulgate",
   "source": "vulgate2",
   "work": "vulgate",
   "work_title": "Lancelot-Grail (the Vulgate Cycle)",
   "branch": "french",
   "citation": "Lancelot-Grail, Vol. II: Lancelot (Lacy trans.)",
   "anchor_label": "[12]",
   "text": "the White Knight loved the queen and was fairly sure that the queen loved him as well",
   "tags": [
    "courtly-love"
   ],
   "restricted": true,
   "validation": {
    "method": "exact",
    "ratio": 1,
    "threshold": 0.9,
    "checked_at": "2026-08-14"
   },
   "spine": null
  },
  {
   "id": "vulgate-holy-vessel-grail",
   "voice": "The Vulgate",
   "source": "vulgate1",
   "work": "vulgate",
   "work_title": "Lancelot-Grail (the Vulgate Cycle)",
   "branch": "french",
   "citation": "Lancelot-Grail, Vol. I: The History of the Holy Grail (Lacy trans.)",
   "anchor_label": "[539]",
   "text": "Ah, sword, you are the thing I prized most except for the Holy Vessel called the Grail",
   "tags": [
    "the-grail",
    "source-of-rule"
   ],
   "restricted": true,
   "validation": {
    "method": "exact",
    "ratio": 1,
    "threshold": 0.9,
    "checked_at": "2026-08-14"
   },
   "spine": null
  },
  {
   "id": "malory-sword-in-stone",
   "voice": "Malory",
   "source": "malory1",
   "work": "malory",
   "work_title": "Le Morte d'Arthur",
   "branch": "english",
   "citation": "Le Morte d'Arthur",
   "anchor_label": "I.v",
   "text": "Whoso pulleth out this sword of this stone and anvil, is rightwise king born of all England",
   "tags": [
    "source-of-rule",
    "sword-and-sovereignty"
   ],
   "restricted": false,
   "validation": {
    "method": "exact",
    "ratio": 1,
    "threshold": 0.9,
    "checked_at": "2026-08-14"
   },
   "spine": {
    "unit": "malory-1-5",
    "paragraph": 0,
    "from": 1324,
    "to": 1415,
    "method": "exact"
   }
  },
  {
   "id": "malory-dolorous-stroke",
   "voice": "Malory",
   "source": "malory1",
   "work": "malory",
   "work_title": "Le Morte d'Arthur",
   "branch": "english",
   "citation": "Le Morte d'Arthur",
   "anchor_label": "II.xvi",
   "text": "for the dolorous stroke thou gavest unto King Pellam three countries are destroyed, and doubt not but the vengeance will fall on thee at the last",
   "tags": [
    "the-wound-and-wasteland",
    "dolorous-stroke",
    "the-cost"
   ],
   "restricted": false,
   "validation": {
    "method": "exact",
    "ratio": 1,
    "threshold": 0.9,
    "checked_at": "2026-08-14"
   },
   "spine": {
    "unit": "malory-2-16",
    "paragraph": 0,
    "from": 1048,
    "to": 1193,
    "method": "exact"
   }
  },
  {
   "id": "malory-pentecostal-oath",
   "voice": "Malory",
   "source": "malory1",
   "work": "malory",
   "work_title": "Le Morte d'Arthur",
   "branch": "english",
   "citation": "Le Morte d'Arthur",
   "anchor_label": "III.xv",
   "text": "charged them never to do outrageousity nor murder, and always to flee treason; also, by no means to be cruel, but to give mercy unto him that asketh mercy",
   "tags": [
    "the-fellowship",
    "pentecostal-oath"
   ],
   "restricted": false,
   "validation": {
    "method": "exact",
    "ratio": 1,
    "threshold": 0.9,
    "checked_at": "2026-08-14"
   },
   "spine": {
    "unit": "malory-3-15",
    "paragraph": 1,
    "from": 353,
    "to": 507,
    "method": "exact"
   }
  },
  {
   "id": "malory-merlin-and-nimue",
   "voice": "Malory",
   "source": "malory1",
   "work": "malory",
   "work_title": "Le Morte d'Arthur",
   "branch": "english",
   "citation": "Le Morte d'Arthur",
   "anchor_label": "IV.i",
   "text": "always Merlin lay about the lady to have her maidenhood, and she was ever passing weary of him, and fain would have been delivered of him, for she was afeard of him because he was a devil's son",
   "tags": [
    "foreknowledge-and-doom",
    "disenchantment"
   ],
   "restricted": false,
   "validation": {
    "method": "exact",
    "ratio": 1,
    "threshold": 0.9,
    "checked_at": "2026-08-14"
   },
   "spine": {
    "unit": "malory-4-1",
    "paragraph": 1,
    "from": 125,
    "to": 318,
    "method": "exact"
   }
  },
  {
   "id": "malory-grail-at-camelot",
   "voice": "Malory",
   "source": "malory2",
   "work": "malory",
   "work_title": "Le Morte d'Arthur",
   "branch": "english",
   "citation": "Le Morte d'Arthur",
   "anchor_label": "XIII.vii",
   "text": "Then there entered into the hall the Holy Grail covered with white samite, but there was none might see it, nor who bare it",
   "tags": [
    "the-grail"
   ],
   "restricted": false,
   "validation": {
    "method": "exact",
    "ratio": 1,
    "threshold": 0.9,
    "checked_at": "2026-08-14"
   },
   "spine": {
    "unit": "malory-13-7",
    "paragraph": 1,
    "from": 703,
    "to": 826,
    "method": "exact"
   }
  },
  {
   "id": "malory-grail-empties-fellowship",
   "voice": "Malory",
   "source": "malory2",
   "work": "malory",
   "work_title": "Le Morte d'Arthur",
   "branch": "english",
   "citation": "Le Morte d'Arthur",
   "anchor_label": "XIII.vii",
   "text": "ye have nigh slain me with the avow and promise that ye have made; for through you ye have bereft me the fairest fellowship and the truest of knighthood that ever were seen together in any realm of the world",
   "tags": [
    "the-grail",
    "the-cost"
   ],
   "restricted": false,
   "validation": {
    "method": "exact",
    "ratio": 1,
    "threshold": 0.9,
    "checked_at": "2026-08-14"
   },
   "spine": {
    "unit": "malory-13-7",
    "paragraph": 3,
    "from": 282,
    "to": 489,
    "method": "exact"
   }
  },
  {
   "id": "malory-love-nowadays",
   "voice": "Malory",
   "source": "malory2",
   "work": "malory",
   "work_title": "Le Morte d'Arthur",
   "branch": "english",
   "citation": "Le Morte d'Arthur",
   "anchor_label": "XVIII.xxv",
   "text": "Right so fareth love nowadays, soon hot soon cold: this is no stability. But the old love was not so; men and women could love together seven years",
   "tags": [
    "courtly-love",
    "the-cost"
   ],
   "restricted": false,
   "validation": {
    "method": "exact",
    "ratio": 1,
    "threshold": 0.9,
    "checked_at": "2026-08-14"
   },
   "spine": {
    "unit": "malory-18-25",
    "paragraph": 1,
    "from": 181,
    "to": 328,
    "method": "exact"
   }
  },
  {
   "id": "malory-excalibur-returned",
   "voice": "Malory",
   "source": "malory2",
   "work": "malory",